[
  {
    "change_id": "GEN2_C000",
    "parent_model": {
      "config_hash": "4f9fdeae7428199a",
      "hp_hash": "f327f9d2ad64cc88",
      "rf_hash": null,
      "dt_ms": 0.1,
      "numerical_config_hash": null
    },
    "parameter_path": "scaffold",
    "pathway": "ledger.init",
    "old_value": null,
    "new_value": null,
    "delta": {
      "factor": null,
      "absolute": null,
      "description": "no param change \u2014 scaffold"
    },
    "reason_before_results": "establish immutable modification history per GEN2_BIOPHYSICAL_QUALIFICATION_v0.1",
    "provenance": "ENGINE_DEFAULT",
    "qualification_target": "scaffold",
    "predicted_generic_effect": "no dynamics change; enables provenance tracking for downstream B0..B12",
    "observed_generic_effect": {
      "note": "scaffold verified: ledger and gate modules importable; file existence checks pass",
      "evidence_state": "OBSERVED"
    },
    "unexpected_effects": [],
    "tests_passed": [
      "import jomission.qualification.ledger",
      "import jomission.qualification.gen2_gates",
      "file existence manifests/gen2_ledger.schema.json",
      "file existence manifests/gen2_Bk_seal.schema.json"
    ],
    "tests_failed": [],
    "resulting_model": {
      "config_hash": "4f9fdeae7428199a",
      "hp_hash": "f327f9d2ad64cc88",
      "rf_hash": null,
      "dt_ms": 0.1,
      "numerical_config_hash": null,
      "artifact": "manifests/gen2_modification_ledger.jsonl"
    },
    "evidence_state": "OBSERVED",
    "timestamp": "2026-08-27T16:28:04Z",
    "author": "W1.0 scaffold",
    "gate": "B0"
  },
  {
    "change_id": "GEN2_C001",
    "parent_model": {
      "config_hash": "4f9fdeae7428199a",
      "hp_hash": "f327f9d2ad64cc88",
      "rf_hash": "e5e331a140ebd37e",
      "dt_ms": 0.1,
      "numerical_config_hash": "4f9fdeae7428199a"
    },
    "parameter_path": "paradigm.drive: uniform \u2192 RFOperator energy-matched",
    "pathway": "paradigm.drive: StimulusSchedule.to_array via RFOperator.to_stimulus_schedule tier=graded with ENERGY_A normalizer (scale amplitude scalar, not L1)",
    "old_value": "uniform 5.0 via condition_to_stimulus_schedule",
    "new_value": "RFOperator.to_stimulus_schedule tier=graded with ENERGY_A normalizer, E_parity\u22645% gate",
    "delta": {
      "factor": 184.55,
      "absolute": "uniform\u2192graded energy-matched (2000/G)",
      "description": "G0 uniform 5.0 (E_off 42.48M) \u2192 G1 graded RFon with ENERGY_A 923.024/921.94/188.493 scaling (E_on 42.49M), parity 0.03% (ratio 0.9997), V1-only, omission-zero"
    },
    "reason_before_results": "N-12 fractured drive: factorial_v0p2 claimed energy-matched (2000/G ratio 1.0) but lifecycle/trajectory still uniform 5.0 (184.55\u00d7 RF confound). Unify to single RFOperator authority with 5% parity gate so RF factor isolates retinotopy not energy (B5).",
    "provenance": "DERIVED",
    "qualification_target": "B5 E_parity\u22645% and V1-only and omission_zero",
    "predicted_generic_effect": "remove 184\u00d7 RF confound; stimulus selectivity becomes measurable without energy artifact",
    "observed_generic_effect": {
      "E_off_AAAB": 42480000.0,
      "E_on_AAAB": 42492488.0,
      "rel_error_AAAB": 0.00029388723955161205,
      "ratio_AAAB": 0.9997061127604484,
      "E_off_BBBA": 42480000.0,
      "E_on_BBBA": 42467512.0,
      "rel_error_BBBA": 0.00029397363465160075,
      "E_off_RRRR": 42480000.0,
      "E_on_RRRR": 42479920.0,
      "rel_error_RRRR": 1.88e-06,
      "omission_AXAB_p2": 0.0,
      "V1_only_V4_sum": 0.0,
      "validate_pass": true,
      "energy_gate_pass": true,
      "parity_within_5pct": true,
      "note": "All parities <0.05% <<5% threshold; omission zero (1e-6 tol); V1-only confirmed; tier graded preserves L1 weights and CV",
      "evidence_state": "OBSERVED"
    },
    "unexpected_effects": [
      "provenance detail: blob centers MODEL_ASSUMPTION recorded in reason_before_results"
    ],
    "tests_passed": [
      "RFOperator.validate() PASS",
      "RFConfig.validate() PASS",
      "prove_jaxfne_target_indices_capability no_modification_needed TRUE",
      "E_parity AAAB 0.00029 \u22640.05 PASS",
      "E_parity BBBA 0.00029 \u22640.05 PASS",
      "E_parity RRRR 1.9e-06 \u22640.05 PASS",
      "omission AXAB p2 0.0 \u22641e-6 PASS",
      "V1-only V4/FEF/PFC drive 0 PASS",
      "tests/test_rf.py PASS"
    ],
    "tests_failed": [],
    "resulting_model": {
      "config_hash": "4f9fdeae7428199a",
      "hp_hash": "f327f9d2ad64cc88",
      "rf_hash": "e5e331a140ebd37e",
      "dt_ms": 0.1,
      "numerical_config_hash": "4f9fdeae7428199a",
      "artifact": "jomission/paradigm/spec.py:make_drive_schedule+compute_drive_energy+assert_energy_parity jomission/ablations/factor_isolation.py:assert_energy_parity_from_schedules+realized_inputs_from_schedule jomission/simulation/factorial_v0p2.py:energy_gate jomission/simulation/lifecycle.py:rf_guard jomission/simulation/trajectory.py:rf_guard"
    },
    "evidence_state": "OBSERVED",
    "timestamp": "2026-08-27T17:30:00Z",
    "author": "W1.1",
    "gate": "B5"
  },
  {
    "change_id": "GEN2_C002",
    "parent_model": {
      "config_hash": "4f9fdeae7428199a",
      "hp_hash": "f327f9d2ad64cc88",
      "rf_hash": null,
      "dt_ms": 0.1,
      "numerical_config_hash": null
    },
    "parameter_path": "network.cell_params: class-homogeneous \u2192 per-neuron jitter \u03c3=0.1",
    "pathway": "intrinsic_heterogeneity: Izhikevich a,b,c,d,drive per-neuron jitter via Izhikevich_CELL_TYPE_DEFAULTS, breaks E 74-spike degeneracy",
    "old_value": "a,b,c,d,drive identical within (area,cell_type) (unique 3: a:3,b:3,c:2,d:3,drive:3 across 400 neurons; v0 unique 400)",
    "new_value": "per-neuron a,b,c,d \u00b110% uniform truncated + c \u00b13mV, drive \u00b110%, deterministic RNG seed (seed ^ 0x9E3779B9 ^ sigma*1e6), bounds clipped, u0=B*v0 recomputed, v0 unchanged",
    "delta": {
      "factor": 0.1,
      "absolute": "sigma=0.1",
      "description": "class-homogeneous -> per-neuron jitter sigma=0.1; config_hash 4f9fdeae7428199a -> a657934252bb9b4d"
    },
    "reason_before_results": "Gap N-10: class-homogeneous a,b,c,d,drive produce 74-spike E degeneracy (std=0, var=0) blocking B1/B2; restore intrinsic heterogeneity via existing JaxFNE Configuration.cell_params seam (emitters.py:55) without duplicating emitter logic; per M-01 minimal delta.",
    "provenance": "MODEL_ASSUMPTION",
    "qualification_target": "B2 CV_rate>0.3, Var(r_E)>0, break 74-spike degeneracy (also B1 firing regime)",
    "predicted_generic_effect": "SD(r_i) rises from 0 to ~2-5 Hz, E counts spread 74\u00b15-10, Fano rises, heterogeneity enables B2/B3 measurement; ordering PV>E preserved",
    "observed_generic_effect": {
      "note": "Smoke n_per_area=100 seed=0: em.a unique 3->400, b 3->400, c 2->400, d 3->400, drive 3->400, v0 400->400; deterministic seed repro true; PV min a 0.090 > E max a 0.022 preserved; bounds clipped; heterogeneity_jitter metadata true",
      "em_a_unique_before": 3,
      "em_a_unique_after": 400,
      "em_drive_unique_before": 3,
      "em_drive_unique_after": 400,
      "em_a_unique_after_gt_30": true,
      "example_a_first5": [
        0.02077424,
        0.02130599,
        0.02171036,
        0.01995918,
        0.02018301
      ],
      "example_drive_first5": [
        3.1539,
        2.8817,
        3.0397,
        3.182,
        3.293
      ],
      "hash_before": "4f9fdeae7428199a",
      "hash_after": "a657934252bb9b4d",
      "hash_distinct": true,
      "evidence_state": "OBSERVED"
    },
    "unexpected_effects": [],
    "tests_passed": [
      "cfg hash distinct (4f9fdeae7428199a != a657934252bb9b4d)",
      "em.a unique 400 >30",
      "deterministic RNG repro seed=0 true",
      "seed1 vs seed0 diff true",
      "VIP b stays negative",
      "PV min a > E max a preserved",
      "bounds clipped within emitter valid ranges",
      "v0 not jittered (unique stays 400)"
    ],
    "tests_failed": [],
    "resulting_model": {
      "config_hash": "a657934252bb9b4d",
      "hp_hash": "f327f9d2ad64cc88",
      "rf_hash": null,
      "dt_ms": 0.1,
      "numerical_config_hash": null,
      "artifact": "jomission/network/builder.py:34-229"
    },
    "evidence_state": "OBSERVED",
    "timestamp": "2026-08-27T17:35:00Z",
    "author": "W1.2",
    "gate": "B2"
  },
  {
    "change_id": "GEN2_C003",
    "parent_model": {
      "config_hash": "4f9fdeae7428199a",
      "hp_hash": "f327f9d2ad64cc88",
      "rf_hash": null,
      "dt_ms": 0.1,
      "numerical_config_hash": null
    },
    "parameter_path": "network.connectivity: within uniform p\u22480.99 \u2192 spatial_sigma=0.08 max_in_degree=25",
    "pathway": "network.connectivity: spatial locality (dense-local/sparse-global)",
    "old_value": "cfg.connectivity(within_area='sparse', within_gain=0.35) uniform random",
    "new_value": "cfg.connectivity(within_area='spatial_local', within_gain=0.35, spatial_sigma=0.08, max_in_degree=25) distance-gated",
    "delta": {
      "factor": 0.25,
      "absolute": "p 0.99\u21920.25, sigma 0.08, max_in 25",
      "description": "within uniform random \u2192 Gaussian distance-gated cap 25"
    },
    "reason_before_results": "Gap N-06: within-area p\u22480.99 uniform random (39600 edges, avg within 0.44 \u2248 jitter, no distance decay) collapses ensemble assay; JaxFNE seam spatial_sigma kernel exists (connectivity.py:222) but not invoked. Minimal G2\u2192G3 via spatial_sigma 0.08 + max_in_degree 25 per parent integration S-01 and gen2_gap_matrix N-06/N-07 Q2, preserving FF/FB (W2) and not adding heterogeneity (M-01 deferred to W1.2).",
    "provenance": "MODEL_ASSUMPTION",
    "qualification_target": "B4 dense-local/sparse-global, W(d) decay p<0.05, Q>0.2, locality_index>3 scaffold",
    "predicted_generic_effect": "within p 0.99\u2192~0.25 local, avg within dist << random, clustering emerges, shared statistics reduced \u2192 heterogeneity prerequisite",